{
   "$schema":"http://json-schema.org/draft-04/schema#",
   "title":"Resume Schema",
   "type":"object",
   "additionalProperties":false,
   "properties":{
      "basics":{
         "type":"object",
         "additionalProperties":false,
         "properties":{
            "name":{
               "type":"string",
               "description":"e.g. Juan Micheli"
            },
            "label":{
               "type":"string",
               "description":"e.g. Web Developer"
            },
            "email":{
               "type":"string",
               "description":"e.g. hey@anib.al",
               "format":"email"
            },
            "phone":{
               "type":"string",
               "description":"e.g.  +33 06 8994 0397 (use any format you like)"
            },
            "website":{
               "type":"string",
               "description":"URL to your website, e.g. http://anib.al",
               "format":"uri"
            },
            "summary":{
               "type":"string",
               "description":"Write a short 2-3 sentence biography about yourself"
            },
            "location":{
               "type":"object",
               "additionalProperties": false,
               "properties": {
                  "postalCode":{
                     "type":"string"
                  },
                  "city":{
                     "type":"string"
                  }
               },
               "required": ["city", "postalCode"]
            },
            "profiles":{
               "type":"array",
               "description":"Specify any number of profiles",
               "additionalItems":false,
               "items":{
                  "type":"object",
                  "additionalProperties":false,
                  "properties":{
                     "network":{
                        "type":"string",
                        "description":"e.g. Github profile"
                     },
                     "username":{
                        "type":"string",
                        "description":"e.g. anaibol"
                     },
                     "url":{
                        "type":"string",
                        "description":"e.g. http://github.com/anaibol"
                     }
                  }
               }
            }
         },
         "required": ["name", "label", "email", "summary"]
      },
      "works":{
         "type":"array",
         "additionalItems":false,
         "items":{
            "type":"object",
            "additionalProperties":false,
            "properties":{
               "company":{
                  "type":"string",
                  "description":"e.g. Facebook"
               },
               "position":{
                  "type":"string",
                  "description":"e.g. Software Engineer"
               },
               "website":{
                  "type":"string",
                  "description":"e.g. http://facebook.com",
                  "format":"uri"
               },
               "logo":{
                  "type":"string",
                  "description":"e.g. http://facebook.com/images/logo.png",
                  "format":"uri"
               },
               "startDate":{
                  "type":"string",
                  "description":"e.g. 2014-06-29",
                  "format":"date"
               },
               "endDate":{
                  "type":"string",
                  "description":"e.g. 2012-06-29",
                  "format":"date"
               },
               "summary":{
                  "type":"string",
                  "description":"Give an overview of your responsibilities at the company"
               },
               "skills":{
                  "type":"object",
                  "description":"Specify multiple accomplishments",
                  "additionalItems":false,
                  "properties":{
                     "organization":{
                        "type":"string",
                        "description":"e.g. Facebook"
                     },
                     "position":{
                        "type":"string",
                        "description":"e.g. Software Engineer"
                     }
                  }
               },
               "highlights":{
                  "type":"array",
                  "description":"Specify multiple accomplishments",
                  "additionalItems":false,
                  "items":{
                     "type":"string",
                     "description":"e.g. Increased profits by 20% from 2011-2012 through viral advertising"
                  }
               }
            }
         }
      },
      "volunteer":{
         "type":"array",
         "additionalItems":false,
         "items":{
            "type":"object",
            "additionalProperties":false,
            "properties":{
               "organization":{
                  "type":"string",
                  "description":"e.g. Greenpeace"
               },
               "position":{
                  "type":"string",
                  "description":"e.g. Software Engineer"
               },
               "website":{
                  "type":"string",
                  "description":"e.g. http://greenpeace.com",
                  "format":"uri"
               },
               "startDate":{
                  "type":"string",
                  "description":"e.g. 2014-06-29",
                  "format":"date"
               },
               "endDate":{
                  "type":"string",
                  "description":"e.g. 2012-06-29",
                  "format":"date"
               },
               "summary":{
                  "type":"string",
                  "description":"Give an overview of your responsibilities at the company"
               },
               "highlights":{
                  "type":"array",
                  "description":"Specify multiple accomplishments",
                  "additionalItems":false,
                  "items":{
                     "type":"string",
                     "description":"e.g. Increased profits by 20% from 2011-2012 through viral advertising"
                  }
               }
            }
         }
      },
      "education":{
         "type":"array",
         "additionalItems":false,
         "items":{
            "type":"object",
            "additionalProperties":false,
            "properties":{
               "institution":{
                  "type":"string",
                  "description":"e.g. Massachusetts Institute of Technology"
               },
               "area":{
                  "type":"string",
                  "description":"e.g. Arts"
               },
               "studyType":{
                  "type":"string",
                  "description":"e.g. Bachelor"
               },
               "startDate":{
                  "type":"string",
                  "description":"e.g. 2014-06-29",
                  "format":"date"
               },
               "endDate":{
                  "type":"string",
                  "description":"e.g. 2012-06-29",
                  "format":"date"
               },
               "gpa":{
                  "type":"string",
                  "description":"grade point average, e.g. 3.67/4.0"
               },
               "courses":{
                  "type":"array",
                  "description":"List notable courses/subjects",
                  "additionalItems":false,
                  "items":{
                     "type":"string",
                     "description":"e.g. H1302 - Introduction to American history"
                  }
               }
            }
         }
      },
      "awards":{
         "type":"array",
         "description":"Specify any awards you have received throughout your professional career",
         "additionalItems":false,
         "items":{
            "type":"object",
            "additionalProperties":false,
            "properties":{
               "title":{
                  "type":"string",
                  "description":"e.g. One of the 100 greatest minds of the century"
               },
               "date":{
                  "type":"string",
                  "description":"e.g. 1989-06-12",
                  "format":"date"
               },
               "awarder":{
                  "type":"string",
                  "description":"e.g. Time Magazine"
               },
               "summary":{
                  "type":"string",
                  "description":"e.g. Received for my work with Quantum Physics"
               }
            }
         }
      },
      "publications":{
         "type":"array",
         "description":"Specify your publications through your career",
         "additionalItems":false,
         "items":{
            "type":"object",
            "additionalProperties":false,
            "properties":{
               "name":{
                  "type":"string",
                  "description":"e.g. The World Wide Web"
               },
               "publisher":{
                  "type":"string",
                  "description":"e.g. IEEE, Computer Magazine"
               },
               "releaseDate":{
                  "type":"string",
                  "description":"e.g. 1990-08-01"
               },
               "website":{
                  "type":"string",
                  "description":"e.g. http://www.computer.org/csdl/mags/co/1996/10/rx069-abs.html"
               },
               "summary":{
                  "type":"string",
                  "description":"Short summary of publication. e.g. Discussion of the World Wide Web, HTTP, HTML."
               }
            }
         }
      },
      "skills":{
         "type":"array",
         "description":"List out your professional skill-set",
         "additionalItems":false,
         "items":{
            "type":"object",
            "additionalProperties":false,
            "properties":{
               "name":{
                  "type":"string",
                  "description":"e.g. Web Development"
               },
               "level":{
                  "type":"string",
                  "description":"e.g. Master"
               },
               "keywords":{
                  "type":"array",
                  "description":"List some keywords pertaining to this skill",
                  "additionalItems":false,
                  "items":{
                     "type":"string",
                     "description":"e.g. HTML"
                  }
               }
            }
         }
      },
      "languages":{
         "type":"array",
         "description":"List any other languages you speak",
         "additionalItems":false,
         "items":{
            "type":"object",
            "additionalProperties":false,
            "properties":{
               "language":{
                  "type":"string",
                  "description":"e.g. English, Spanish"
               },
               "fluency":{
                  "type":"string",
                  "description":"e.g. Fluent, Beginner"
               }
            }
         }
      },
      "interests":{
         "type":"array",
         "additionalItems":false,
         "items":{
            "type":"object",
            "additionalProperties":false,
            "properties":{
               "name":{
                  "type":"string",
                  "description":"e.g. Philosophy"
               },
               "keywords":{
                  "type":"array",
                  "additionalItems":false,
                  "items":{
                     "type":"string",
                     "description":"e.g. Friedrich Nietzsche"
                  }
               }
            }
         }
      },
      "references":{
         "type":"array",
         "description":"List references you have received",
         "additionalItems":false,
         "items":{
            "type":"object",
            "additionalProperties":false,
            "properties":{
               "name":{
                  "type":"string",
                  "description":"e.g. Timothy Cook"
               },
               "reference":{
                  "type":"string",
                  "description":"e.g. Joe blogs was a great employee, who turned up to work at least once a week. He exceeded my expectations when it came to doing nothing."
               }
            }
         }
      }
   }
}
